댓글 작성자,댓글 내용,댓글 작성 시간
딥슬로,유럽 중동난민으로 장악당한거 알지? 이스라엘 아니엿으면 유럽이랑 중동 세계3차대전 일어낫다 이스라엘이 선견지명으로 중동가서 애들 두들겨 패주고 잇어서 그나마 이정도지,2024-09-30 14:49:13
문재인,미국을 한국에서 몰아내자,2024-09-30 14:49:14
동우,사우디 UAE 오만이 후티 때린닥다고 봄,2024-09-30 14:49:15
SEUNG KIM,이스라엘이 확실히 힘의 질서로 지배하는게 편하지.,2024-09-30 14:49:16
프사이,이란도 미국 무서워서 못 움직이는거지,2024-09-30 14:49:25
KorGuys,이스라엘 지금까지 방어만하다가 이번에 참교육 지대로 들어가네. ,2024-09-30 14:49:25
이이정호,후티 섁히도 듸질려고 환장 했구만,2024-09-30 14:49:25
늘그래,이니,2024-09-30 14:49:27
뽀율s,해즈볼라 잡으면 레바논 정부가 완벽하게 레바논 장악하는거니,2024-09-30 14:49:30
나다가,그렇게 발강 만들어서 다 제거해놓고 ㅋㅋ,2024-09-30 14:49:34
진리&자유,태국 무에타이가 한국 태권도보다 더 쎄다. 그리고 태국에는 트랜스젠더들이 많아서 한국이 진다.,2024-09-30 14:49:34
B급감성,중공 댓글 부대는 어디에나 존재한다,2024-09-30 14:49:36
프사이,이란 움직이면 미국이 제대로 조질려고 준비중인데,2024-09-30 14:49:36
나다가,그게 중국이했냐? ㅋㅋ 미국이했지,2024-09-30 14:49:39
늘그래,미국최강,2024-09-30 14:49:41
오오오,여왕아 형은 사진가지고ㅠ장난치는애들 잘잡아낸데 구라작작치자 ㅋㅋㅋㅋㅋ,2024-09-30 14:49:45
B급감성,한국내 각종 대형 커뮤니티 사이트에 댓글 공작 오지지,2024-09-30 14:49:50
나다가,미국 말 안들으면 그냥 다 제거야 ㅋㅋ,2024-09-30 14:49:52
나다가,그게 세계 정의지 ㅋㅋㅋ,2024-09-30 14:49:57
진리&자유,미국은 이빨 빠진 호랑이다. ㅋㅋㅋ,2024-09-30 14:50:00
늘그래,건드리지 말아,2024-09-30 14:50:00
M-J,차이나 댓글 부대는 어디나있네,2024-09-30 14:50:01
문재인,미국을 한국에서 몰아내고 주한 중군으로 만들어야 한다,2024-09-30 14:50:02
SEUNG KIM,헤즈볼라가 이스라엘 건드렸지. 하마스와 연대해서.,2024-09-30 14:50:02
고 길동^^,1700키로면 급유는 항모에서 햇나?,2024-09-30 14:50:06
화이팅,어차피 한번죽는 인생 우리군도 이스라엘에 파병하여 테러분자 테러국가 박사내자,2024-09-30 14:50:07
Anthony Quinn,ㅋㅋ 미군의 한국 학살이 어디 증거가 있냐? 북괴와 중공군에의한 대한민국 국민들 학살은 어떻게생각하냐?,2024-09-30 14:50:07
김현빈,이란이 중국한테 도와주세요 하면 웃길듯,2024-09-30 14:50:11
김진현,이란은 절대 이스라엘 공격 못한다,2024-09-30 14:50:12
나다가,미국은 핵 쏴본나라야 ㅋㅋ 말안들음 핵맞지,2024-09-30 14:50:16
tsolidus1,저 조그마한 나라가 대단하다.대한민국은 이스라엘을 롤모델로 삼아야 한다.자체 핵무장으로 가자!,2024-09-30 14:50:16
둘리,이스라엘이 군사력 1위다,2024-09-30 14:50:17
228 choi,미국이 이빨바졌어도 잇몸으로 전세계 상대가능할껄 ㅋ,2024-09-30 14:50:19
안영권,이 중 한대가 우리나라 와서 와이티엔에 박아뿌리지!,2024-09-30 14:50:21
Jun,"중동 국가중 미사일 요격 시스템 있는곳이 얼마 없음. 이스라엘, 이란 전쟁시 이란 개발림. 선뜻 전쟁 어려움.",2024-09-30 14:50:21
오오오,여왕이 어디갓냐? ㅋㅋㅋㅋㅋㅋㅋㅋㅋ,2024-09-30 14:50:22
오늘도 내일도,이스라엘 보유미사일만 1경치가까이있다는 들리는 군사전문가얘기가 거짓말이아닐꺼같다,2024-09-30 14:50:23
나다가,미국말 안들으면 핵처맞을꺼야 ㅋㅋ,2024-09-30 14:50:29
프사이,이미 이란 턱 밑에 항모전단 와있음,2024-09-30 14:50:32
늘그래,거짓말 빨강색,2024-09-30 14:50:32
이이정호,이스라엘 지짜 잘한다 이참에 악의축 하메네이도 없에라,2024-09-30 14:50:33
뽀율s,후티반군도 예맨정부 반대세력아님?,2024-09-30 14:50:35
나다가,이스라엘도 100% 뒷통수맞는다 봐라 ㅋㅋ 미국에 핵맞을수도잇음,2024-09-30 14:50:39
VIP,와 이스라엘이 러시아보다 훨 잘하네,2024-09-30 14:50:41
김현빈,중국참전하면 그림 대박일듯,2024-09-30 14:50:41
오오오,여왕이 아가리 졸털더만 조용하노 ㅋㅋㅋㅋ,2024-09-30 14:50:41
색즉시공공즉시색,이빨 빠진 미국이라도 전세계랑 전쟁해서 이길수 있음,2024-09-30 14:50:42
김진현,공격했다간 이스라엘이 핵 시설 및 중요시설을 그냥 놔두지 않을 것이기 때문,2024-09-30 14:50:42
문재인,이스라엘 땅이 좁아서 그냥 미사일 동시다발적으로 쏘면 이스라엘 그냥 땅 없어짐,2024-09-30 14:50:47
프사이,미국 항모전단이 이란 공군력보다 훨씬쎄다,2024-09-30 14:50:52
나다가,중국이 왜 참전해 ㅋㅋ,2024-09-30 14:50:54
진리&자유,한국은 대만과 붙어도 박살난다. ㅋㅋ 정보사 정보 다 털려서 ㅋㅋ,2024-09-30 14:50:55
김진현,공군과 미사일로 때려부수지,2024-09-30 14:50:55
안태건, 이스라엘 멋지다,2024-09-30 14:50:55
JG KIM,제대로 아는거 하나도 없는 똘빡들이 미국이 어쩌네 이스라엘이 어쩌네 채팅질 ㅋㅋㅋ 어휴 방구석 국제전문가들,2024-09-30 14:50:59
TH K,그노메 어. 어. 어. 어. 어. 어...말을,2024-09-30 14:51:01
SEUNG KIM,세상이 변했다. 미국의 첨단무기 전성시대다.,2024-09-30 14:51:06
동우,대포같은 미사일 2만개는 별의미 없는데,2024-09-30 14:51:07
R, 지지!,2024-09-30 14:51:09
진리&자유,한국은 좁밥이다ㅡ,2024-09-30 14:51:11
김진현,이란 공군력 별거 없다,2024-09-30 14:51:14
마임,이스라엘 잘한다 테러 하는 놈들은 한번$ 맟을 보여주어야 까불지 않치 시원하다,2024-09-30 14:51:14
하늘,이스라엘 든든하네 ,2024-09-30 14:51:14
228 choi,중국이 머리에 총맞았냐 참전하게 ㅋㅋ,2024-09-30 14:51:16
나다가,미 첨단무기 드론에 다 박살나느중 ㅋㅋ,2024-09-30 14:51:18
진리&자유,한국은 파키스탄과 붙어도 진다ㅡ,2024-09-30 14:51:20
오오오,여왕이 찾습니다 제보바람 ㅋㅋㅋㅋ,2024-09-30 14:51:22
동우,계속 미사일 2만개 이야기 하니 정밀 미사일인줄 알게됨...일반일들,2024-09-30 14:51:25
프사이,요즘은 해군력하고 공군력이 주력이야,2024-09-30 14:51:26
김진현,뜨는 순간 이스라엘의 밥이 되지,2024-09-30 14:51:26
김상기,이스라엘 방공망 못뚫어 등시야 그지같은 미사일로 잘도 뚫겟다 ㅋㅋㅋㅋ,2024-09-30 14:51:28
YDPF,3차대전 드가자,2024-09-30 14:51:30
문재인,한국은 자뻑이 심한나라. 군사력 헤즈볼라랑 비슷함,2024-09-30 14:51:30
나다가,10만원짜리로 1천억짜리 박살나는 미국무기,2024-09-30 14:51:34
프사이,육군력은 점령할때 필요한거지,2024-09-30 14:51:35
YDPF,세계핵전쟁이 코앞이다,2024-09-30 14:51:36
B급감성,미 우방 국가들이 너무나 강력해서,2024-09-30 14:51:37
SEUNG KIM,80년대 방식으로 싸우는 러시아 무기로 아무것도 못한다. 우크라이나 전쟁처럼.,2024-09-30 14:51:39
둘리,한국은 몰공과 싸워도 진다,2024-09-30 14:51:42
나다가,요즘 드론시대라 ㅋㅋ 미국 천단무기 쓰레기됨,2024-09-30 14:51:46
동우,:radioactive:,2024-09-30 14:51:46
한국,전세계 재산이 27%로가 이스라엘 유대인꺼다 그럼 머다 ?,2024-09-30 14:51:48
둘리,이스라엘 잘한다,2024-09-30 14:51:50
뚜루루,여자 말 왜그럼?,2024-09-30 14:51:52
나다가,개비싸고 효율없는게 미국무기 ㅋㅋ,2024-09-30 14:51:57
닥터후,대만3차세계대전 ㄱㄱ,2024-09-30 14:51:58
나다가,러시아에서 봤으면서 ㅋㅋ,2024-09-30 14:52:00
김현빈,한국정보 세계5위 였는데 위에서 다 끈어버렸지,2024-09-30 14:52:01
뚜루루,여자 에이아이야?,2024-09-30 14:52:03
김기수,이란도 쫄았다,2024-09-30 14:52:05
늘그래,한국세계최강 군사력.이스라엔. 능가,2024-09-30 14:52:08
SEUNG KIM,한국의 7군단이 항공지원만 받으면 거침없이 베이징까지 간다.,2024-09-30 14:52:09
이원희,흠..,2024-09-30 14:52:11
228 choi,러시아나 드론에 줘털리지 미국한테 그게 먹힐까?,2024-09-30 14:52:11
문재인,이스라엘만 초토화 시켜버리면 세계경제 잘돌아감,2024-09-30 14:52:13
KorGuys,꽁꽁 숨어서 회의하고 있는 테러분자 지휘관들 몰살시키는 미친 첩보력이 무서운거임,2024-09-30 14:52:17
홍명보,나스랄라 죽일때 사용한 폭탄이 미국산이란다 ,2024-09-30 14:52:20
GPTV,문제인이 한국 정보력 아작 냈지.,2024-09-30 14:52:22
프사이,이란이 당연히 쫄지 미국이 바로 턱밑에 있는데 안쪼는 나라가 어딨어,2024-09-30 14:52:25
프사이,러시아도 쫄걸,2024-09-30 14:52:28
나다가,이스라엘 100% 미국이버림 ㅋㅋ 봐봐 ㅋㅋ,2024-09-30 14:52:32
일신우일신,ㅋㅋ,2024-09-30 14:52:32
꼬츠향,미국이 이스라엘 손을 빌려 잡것들 청소하는구나 ㅋㅋㅋㅋㅋ,2024-09-30 14:52:34
나다가,일본처럼 된다 ㅋㅋㅋ,2024-09-30 14:52:35
둘리,이스라엘 쫄아서 입으로만 싸운단다 ㅋㅋㅋ,2024-09-30 14:52:35
B급감성,드론은 전자파 교란 시키면 무용지물임 ,2024-09-30 14:52:36
GPTV,중국에 갖다 바쳤지.,2024-09-30 14:52:37
Pes Her,양자역학적으로 3차 핵전쟁 은. 정해진 운명이다,2024-09-30 14:52:38
SEUNG KIM,러시아는 끝났지.,2024-09-30 14:52:39
TH K,말 드럽게 못하네 저노무 아저씨. 어 .아. 어. 아. 어. 아,2024-09-30 14:52:49
228 choi,미국이 지금 이스라엘 지원하는거야 뭘 버려 ㅋㅋㅋ,2024-09-30 14:52:50
일신우일신,백두산위쪽이 다 험준한 산악지역이라 힘듬,2024-09-30 14:52:50
이원희,자. 일제 시대와 이스라엘 시대의 차이점.... 일제는 땡전 한푼 안쓰고 조선 ,2024-09-30 14:52:51
김상기,미국은 이엠피탄 잇어서 드론도 가다가 다추락이야,2024-09-30 14:52:54
GPTV,재명이가 시키더냐.,2024-09-30 14:52:55
나다가,미국은 이스라엘 이용해서 다 빨아먹고 100%버리고 일본처럼 만들겠지 ㅋㅋ,2024-09-30 14:52:56
나다가,안봐도 뻔함,2024-09-30 14:52:58
프사이,미국이 이스라엘을 어떻게 버리냐,2024-09-30 14:53:01
이원희,꿀꺽!!~ 이스라엘은 그에 비해 토지 매입부터~,2024-09-30 14:53:02
이이정호,후티반군 빨리 평정하고 후티 섁히들도 모조리 없에라,2024-09-30 14:53:04
M-J,이란 바로 옆에 미군기지 있어서 못 나옴,2024-09-30 14:53:04
뚜루루,근거있는자신감,2024-09-30 14:53:05
둘리,전과 4범 구속하라,2024-09-30 14:53:09
프사이,중동에서 거의 유일하다고 할정도로 친미국가인데,2024-09-30 14:53:11
일신우일신,고구려가 방어할수있던것도 그때문임,2024-09-30 14:53:14
프사이,미국은 이스라엘 절대 못버려,2024-09-30 14:53:16
KorGuys,이란도 눈치보며 말만하는거 보소,2024-09-30 14:53:18
오오오,여왕이 자기 프샤라고 구라치다 뜨금해서 도망갔네 ㅋㅋㅋㅋㅋㅋㅋㅋㅋㅋㅋㅋㅋ,2024-09-30 14:53:19
홍명보,미국은 이스라엘 절대 못버림 미국내 유대인이 750만명이나있고 정치적으로 금전적 지원 해주는 금액만해도 막대함,2024-09-30 14:53:22
Chris JI,이란등 opec 산유국인 나라들은 전쟁을 할 수가 없음. 기름 퍼서 아주 아주 잘사는 나라인데. 이스라엘이 유전에 미사일 쏘면 그냥 화약고 터지는거고 나라가 쫄딱 망하는데 아무리 미워도 전면전 못하고 뒷구녕으로 이스라엘하고 싸우ㅠ라고 무기 지원밖에 더 하겠나.. 절대 전면전은 없다. 그냥 반이스라엘 조직들 개쳐발리겠지.,2024-09-30 14:53:26
홍명보,미국은 뒷돈 합법임,2024-09-30 14:53:27
최영준,말뿐인 헤즈볼라였네,2024-09-30 14:53:31
한국,시아파 수니파 이둘은 앙숙이라 아랍 편 나눈다,2024-09-30 14:53:31
228 choi,이스라엘이 핵쏴도 미국은 안버림,2024-09-30 14:53:32
나다가,한국 알바 대통령직은...... 이거 심각해,2024-09-30 14:53:36
진리&자유,아아 한국이 이길 수도 있겠다. 천공이 있잖아 ㅋㅋ 5천만 국민들의 영적 스승님,2024-09-30 14:53:37
색즉시공공즉시색,유대인이 미국을 지배하고 있어서 미국은 이스라엘 못 버림,2024-09-30 14:53:37
홍명보,미국은 이스라엘 절대못버림,2024-09-30 14:53:40
so so,지휘부 위치는 미국이 다알려줘,2024-09-30 14:53:40
둘리,미국은 앞돈임,2024-09-30 14:53:42
프사이,미국은 그냥 이스라엘 달래면서 여기까지만 하자고 하는거지,2024-09-30 14:53:48
M-J,이란도 뭘 하고 싶어도 카드가 없음,2024-09-30 14:53:49
홍명보,앞돈이 맞네,2024-09-30 14:53:49
KorGuys,미국 존재 자체가 이스라엘 무쌍찍게 만드는 거임,2024-09-30 14:53:51
김진현,이란이 하메네이도 함부로 모습 드러내지 못한다. 드러냈다간 이스라엘의 표적이 될 테니까,2024-09-30 14:53:56
son uw,2차대전. 최대피해자가 지금은 가장 최악의 깡패국가가된듯ㆍㆍ,2024-09-30 14:54:13
몽구스,이스라엘 개쎄넹,2024-09-30 14:54:13
진리&자유,한국은 최고의 민주주의 국가이다. 화류계 여성도 영부인이 될 수 있는 나라다.,2024-09-30 14:54:14
YAN,내가 역사보니까 영국놈들이 2차대전때 오스만 견제하려고 유대인들한테 우리편들면 나라세워준다고 한게 모든 원흉이더라 ,2024-09-30 14:54:14
김상기,헤즈볼라 후티 이런애들이 테러나 할줄 알지 제대로전쟁 가능 할거같냐? ㅋㅋㅋ,2024-09-30 14:54:15
홍명보,미국 상원 하원의원 대부분 유대인한테 금전적 지원 받고있음,2024-09-30 14:54:16
샤벳트,이스라엘 홧팅,2024-09-30 14:54:18
포크포크,후티도 개털림? ㅋㅋㅋ,2024-09-30 14:54:20
GPTV,하메네이=정은이=재명이,2024-09-30 14:54:20
일신우일신,이란도 1:1이면 하겠지만 우러전 보고 느끼겠죠,2024-09-30 14:54:25
228 choi,이란 지금 겁나쫄아있을걸 지들 핸드폰이 언제터질지모르거덩 ㅋㅋ,2024-09-30 14:54:26
프사이,후티도 개털리지,2024-09-30 14:54:26
M-J,하메네이 이미 쫄아서 숨었음,2024-09-30 14:54:30
KorGuys,미국없었으면 강원도만한 이스라엘 진작에 사라졌음,2024-09-30 14:54:32
프사이,후티가 무슨 공권력이 있나,2024-09-30 14:54:34
일신우일신,휘말리기 싫은거임,2024-09-30 14:54:36
나다가,"알바 대통령직 ㅋㅋ 아무나 앉혀놓고 국가돈 탈탈 털어먹고, 사면받는 이상한 고위직 자리...",2024-09-30 14:54:37
ace,전문가 맞냐??,2024-09-30 14:54:37
한국,미국도 탬버린한테 못덤빈다 한번흔들면 미군들 항복한다,2024-09-30 14:54:39
프사이,미사일도 후진거 쏘더만,2024-09-30 14:54:40
주식은 눈치쌈,신중 = 겁 먹음,2024-09-30 14:54:40
포크포크,하메네이 숨었잖아,2024-09-30 14:54:44
누꼬,하메네이만 제거하면 이란 민주화한다,2024-09-30 14:54:44
아스타나,이스라엘이 공격하는 나라들이 모두 친중이란걸 명심하자,2024-09-30 14:54:46
진리&자유,"곰이 여성이 되셨는데 그 분이 웅녀요, 우리의 국모다.",2024-09-30 14:54:50
jayson lim,세계에서 제일 뛰어난 아랍어사전과 페르시아어 사전이 누가만든건지 아는사람? ... 그걸 알면 왜 이스라엘이 강한지 자연스럽게 이해가 됨,2024-09-30 14:54:53
MUSE,"2차대전 최대 피해자는 이미 죽은 유대인들이다, 지금 있는 이스라엘은 모두 배신했던 유대인들 아니냐??",2024-09-30 14:54:53
나다가,"알바 대통령직 ㅋㅋ 아무나 앉혀놓고 국가돈 탈탈 털어먹고, 사면받는 이상한 고위직 자리...이체제 누가만든거야??",2024-09-30 14:54:55
홍명보,후티는 우리나라 보이스카웃선에서 정리가능,2024-09-30 14:54:58
일신우일신,이란이 직접공격받으면 몰라도,2024-09-30 14:55:02
손남기,"이스라엘이 민족적으로 한번도 알라신께 굴복한 적이 없었습니다 이제 그 마지막 단한번의 굴복의 때가 다가오고 있는데 미국과 유럽의 짐승정부가 생겨나면 유대인의 3분의 1이 순교, 목베임을 당하게 될 것입니다 지금 전세계의 미움을 받기까지 폭격을 멈추지 않을 것이구요 결국 이스라엘이 버림을 받을 것입니다 ㅎㅎ 감사해요",2024-09-30 14:55:02
딥슬로,미국도 유대인 아니엿으면 이정도로 패권국 오래유지할수 없었지,2024-09-30 14:55:04
나다가,"알바 대통령직 ㅋㅋ 아무나 앉혀놓고 국가돈 탈탈 털어먹고, 사면받는 이상한 고위직 자리...이체제 누가만든거야??",2024-09-30 14:55:09
진리&자유,웅녀 다음으로 성공한 여성이 바로 김건희 누님이다.,2024-09-30 14:55:13
몽구스,아 그래? 친중이면 이스라엘 홧팅~,2024-09-30 14:55:18
이건지,전문가 반대로 생각하면 딱 맞아 떨어짐,2024-09-30 14:55:18
프사이,이란 제외하고 하마스 후티 헤즈볼라 합쳐서 이스라엘한텐 안돼,2024-09-30 14:55:20
나다가,유대인 << 종교야 ㅋㅋ,2024-09-30 14:55:22
ace,이스라엘은 지상전 한다고 했는데 이란이야기 하고 있네........... 이스라엘은 그냥 시나리오대로 가고 있는데 먼 소리냐,2024-09-30 14:55:23
나다가,유대교가 맞음,2024-09-30 14:55:28
딥슬로,미국을 키운게 유대인인데,2024-09-30 14:55:30
YAN,근데 정치범 형량은 의미없는듯 박근혜 거의 30년형 받고도 지금 밖에나와있음..,2024-09-30 14:55:33
SEUNG KIM,소서노이지. ,2024-09-30 14:55:33
주식은 눈치쌈,이란은 보복 못하고 결국엔 혼자 덩그러니 남아서 강제로 민주화 당함,2024-09-30 14:55:37
나다가,유대교지,2024-09-30 14:55:37
밥묵은나?,후티 대변인 갸 목소리 듣고잡다 안나오나?ㅋㅋㅋ,2024-09-30 14:55:38
김현빈,중국이 참전하면 어케됨,2024-09-30 14:55:39
몽구스,유대인이랑 유태인이랑 뭔 차이임?,2024-09-30 14:55:44
홍명보,걍 계속 귀찮게 하는거지 절대 못이김 하마스 헤즈볼라 후티로,2024-09-30 14:55:45
나다가,유대교가 미국 돈을 장악한거지,2024-09-30 14:55:47
S tellarators,알라후 아크바르!!,2024-09-30 14:55:56
아스타나,큰대랑 클태의 차이인가,2024-09-30 14:55:58
프사이,헤즈볼라가 저렇게 털리는데 후티가 어쩌게 ㅋㅋㅋ,2024-09-30 14:56:00
나다가,미국돈을 장악해서 세계에 달러만쓰게 만든게 유대교인들,2024-09-30 14:56:03
보람상조,진리자유잡혀간다 이 라도 시키야,2024-09-30 14:56:04
김상기,중국참전 하면 인도가 뒤통수 후림,2024-09-30 14:56:06
GPTV,저 실력으로 그 도안 까불었던거야?,2024-09-30 14:56:08
프사이,하마스는 이미 끝난거나 마찬가지고,2024-09-30 14:56:13
일신우일신,점하나차이,2024-09-30 14:56:16
나다가,그달러를 혁파하려는게 블릭스,2024-09-30 14:56:17
SEUNG KIM,소서노는 고구려를 건국과 백제도 건국을 엄청 많이 도와줬지. ,2024-09-30 14:56:17
홍명보,유대인 유태인 같은말,2024-09-30 14:56:17
ace,이스라엘은 그냥 자기가 하고 싶은거 하고 있어... 레바논 지상군 투입할거야,2024-09-30 14:56:20
누꼬,워치만 알면 그냥 디짐 벙커버스터로 집중 폭격하면 소리 진동으로 디짐,2024-09-30 14:56:21
진리&자유,소서노는 킹메이커지만 원래 공주출신 ㅋㅋㅋ 김건희도 킹메이커인데 화류계 출신,2024-09-30 14:56:22
나다가,블릭스 통화 만드니깐 전쟁일으키는 미국 ㅋㅋ,2024-09-30 14:56:26
M-J,후티 대변인 중독성 있음,2024-09-30 14:56:27
몽구스,그렇군,2024-09-30 14:56:29
쥬양,예멘 주요 중요 군시설은 지산에 없어요. 불꽃 놀이 일뿐 의미 없어,2024-09-30 14:56:30
홍명보,"따라서, ""유대인""이 표준화된 표현이며, ""유태인""은 과거의 번역 용어",2024-09-30 14:56:36
한국,전문가들이 일반사람도 생각할수있는 뇌피셜만 애기하누,2024-09-30 14:56:40
김현빈,중국은 참전 하려면 태평양 지나야 하니 힘들듯,2024-09-30 14:56:45
나다가,블릭스 통화 만드니깐 미국이 달러독점 지킬려고 계속 전쟁일으키는중,2024-09-30 14:56:46
jayson lim,레바논 국경지대만 정리한다면 빨리 큰 피해없이 정리되겟지만.;.. 베이루트까지 들어간다면 이건 이스라엘도 각오해야할걸? 근데 베이루트까지 들어가진않을걸? 국경부근 레바논남부만 정리할거로 예상한다 ,2024-09-30 14:56:49
진리&자유,그래서 김건희가 소서노보다 더 위대하다ㅡ,2024-09-30 14:56:56
일신우일신,유다인,2024-09-30 14:56:57
보람상조,진리자유 신고했다,2024-09-30 14:56:57
프사이,이란이 어떻게 나오냐가 중요한거지 지금,2024-09-30 14:56:58
KorGuys,둘 중 하나가 괴멸해야 끝나는 전쟁임. 평화 논할 필요가 없음,2024-09-30 14:57:03
SEUNG KIM,남자가 많이 있지.,2024-09-30 14:57:09
몽구스,이란쫄,2024-09-30 14:57:10
프사이,이란이 미친짓하면 진짜 크게 전쟁나는거임,2024-09-30 14:57:11
나다가,달러 독점시대 ㅋㅋ 블릭스 통화 못만들게 하려고 전쟁 계속 일으키지 ㅋㅋㅋㅋㅋㅋㅋㅋㅋ,2024-09-30 14:57:14
김상기,중국은 전쟁하고 싶으면 인도부터 이겨야해서 전쟁 못해,2024-09-30 14:57:15
나다가,실체를 알고 응원해라,2024-09-30 14:57:18
진리&자유,신고해라 ㅋㅋㅋ 김건희 존경한다. ㅋㅋㅋ,2024-09-30 14:57:19
S tellarators,엄러 어쿠바르 알라함 자르 니카부르 이모시날 케바이수 아닐 함나르 함나르 아닐부.,2024-09-30 14:57:21
DI hiền vô cực,Nam mô a Di Đà Phật,2024-09-30 14:57:23
홍명보,이란 적어도 이스라엘 본토 공격은 못해도 레바논 방어는 해줄거 같은데,2024-09-30 14:57:25
228 choi,중국은 지금 겨우겨우 미국 발끝따라왔는데 못나대지 지금나왔다간 뒤져,2024-09-30 14:57:34
진리&자유,난 김건희 누님이랑 꼭 친할거야,2024-09-30 14:57:34
누꼬,저넘도 소리 진동으로 디짐,2024-09-30 14:57:38
비빔젖돌이,캡쳐중,2024-09-30 14:57:41
비빔젖돌이,무조건 신고넣는다,2024-09-30 14:57:50
so so,폭탄100발이면 돈이얼마야 미국이 위치알려줬지머,2024-09-30 14:57:52
나다가,달러 독점유지하려고 전쟁일어나는중이다 ㅋㅋㅋ,2024-09-30 14:57:54
YAN,근데 사우디는 어케 지나간거임 사우디가 영공 제공해준거임 ?,2024-09-30 14:57:56
몽구스,나스랄라,2024-09-30 14:57:59
홍명보,유튜브 신고 넣어봤자 뭐 되냐,2024-09-30 14:58:00
홍명보,ㅋㅋ,2024-09-30 14:58:01
몽구스,나스랄라블라,2024-09-30 14:58:04
프사이,대공망이랑 공군력 없으면 저렇게 되는거임,2024-09-30 14:58:06
나다가,블릭스 통화 주도하는게 러시아고 ㅋㅋㅋㅋㅋㅋㅋ 그래서 러시아 괴롭히는중,2024-09-30 14:58:07
비빔젖돌이,벌금 쎄다던데 잘 물어,2024-09-30 14:58:08
ace,이란이 변수가 아니야........... 이스라엘이 경고 하던지 중단하던지.. 이스라엘 맘대로 하고 있는 상황인데........... 이란은 미국때문에 가만 있느것이고,2024-09-30 14:58:09
228 choi,ㅇㅇ 미국이 정보다 주고있는거,2024-09-30 14:58:10
아스타나,김건희 들먹이는 순간 친중세력임,2024-09-30 14:58:10
딥슬로,건희가 바로 천한것이라고 걷어찰듯,2024-09-30 14:58:12
M-J,"이란은 대규모 파병도 불가능 함,레바논 못 지켜줌",2024-09-30 14:58:16
홍명보,유튜브 신고로 벌금문다는 개 호구가있네 ,2024-09-30 14:58:24
프사이,대공시스템하고 공군력 잇으면 저렇게 일방적으로 폭격 맞겠냐,2024-09-30 14:58:27
포크포크, 멋있다 이스라엘,2024-09-30 14:58:29
아스타나,친중세력이 김건희 물고 늘어짐,2024-09-30 14:58:31
한국,대조영 미모사 대중상 걸사비우 금란 걸사비우 흑수돌 퉁소 계필사문 말갈족만 데려가도 테러집단 정리한다,2024-09-30 14:58:34
jayson lim,사우디와 이집트 눈에가시가 후티반군인데.. 겉으로 표시는 안해도 속으로 이스라엘 잘한다잘한다 응원열심히 하고잇을걸? ㅎㅎㅎㅎ ,2024-09-30 14:58:38
S tellarators,전과자 이재명이가 감옥 안가는 나란데..뭐.. 한국에 법이 잇냐.. ,2024-09-30 14:58:43
송지수,세계대전 가자... 빚만 12억이다,2024-09-30 14:58:45
DoHyun K,전쟁의광~,2024-09-30 14:58:53
나다가,홍명보 신고하면 잡혀갈수 잇음 유도리있게 잘써야함,2024-09-30 14:58:55
프사이,이집트는 참전 안할거 같고,2024-09-30 14:58:56
이원희,흠...,2024-09-30 14:59:02
잠실왕자,후티 대변인 목서리,2024-09-30 14:59:05
woo y,이란이 무슨힘으로 레바논 지켜줘요..? 그럴힘이 없어요,2024-09-30 14:59:05
so so,벙커버스터 100발이면 북한돼지도 잡는다,2024-09-30 14:59:07
이원희,전 잘 모르겠습니다만...,2024-09-30 14:59:09
김상기,그럼 한국은 피해자가 숨어 살아야하는 나라야 ㅋㅋㅋ,2024-09-30 14:59:10
228 choi,째 눈 풀렷네 ㅋㅋ,2024-09-30 14:59:13
진리&자유,김건희는 블랙홀이다.,2024-09-30 14:59:17
나다가,달러 독점 지킬려고 지금 전쟁일으키는게 미국 ㅋㅋㅋ,2024-09-30 14:59:19
