댓글 작성자,댓글 내용,댓글 작성 시간
david,멋지네 ,2024-09-30 14:14:15
실시간,:hand-pink-waving:,2024-09-30 14:15:00
실시간,:reminder_ribbon:,2024-09-30 14:15:17
붕파이터,요맨,2024-09-30 14:16:02
붕파이터,와유,2024-09-30 14:16:07
Theophilus ,표적 사살의 달군!! IDF!!,2024-09-30 14:16:34
JH C,후티 대변인은죽이지마라..너무 웃긴다.,2024-09-30 14:16:42
이상보,이스라엘 작전은 세계최고이구나 부럽다,2024-09-30 14:16:53
Theophilus ,표적 응징의 썰군! 확성기!!,2024-09-30 14:17:30
산행전야,이스라엘 제대로 하네 ...완전 제거해야 ,2024-09-30 14:17:39
매매,이스라엘이 진짜 강하고 멋진 나라네,2024-09-30 14:17:51
매매,자국 영토 자국민 떄리면 어떻게 되나 제대로 보여주네,2024-09-30 14:18:00
아늘한,정말 나이스,2024-09-30 14:18:11
c t k,일단 자국구민에대한 공격은 절대 가만안둔는 이스라엘에 한표쥰다,2024-09-30 14:18:48
전병찬,헤즈볼라 요맨 홧팅,2024-09-30 14:19:33
나이어린너구리,사우디는 안움직이나,2024-09-30 14:19:37
Rosa,이스라엘 승리~,2024-09-30 14:20:04
OMG,기괴하다. 땅 뺏고 기어들어와 사는 강도가 쎄다고 박수치는 사람들ㅋㅋ,2024-09-30 14:20:06
સામાન્ય જીવન,예맨으로 지상군이 투입될 일이 없으니 이스라엘이 마구 확전을 하는구나.,2024-09-30 14:20:32
Rosa,악인들만 집중 제거,2024-09-30 14:20:41
Theophilus ,니 남에도 절대 배치 요망 ㅡ 표적 사살의 달군! IDF!!,2024-09-30 14:20:41
콜오브카오스,우리나라는 똥물풍선에 쫄잖아,2024-09-30 14:20:44
전병찬,기독교는 왜케 전쟁을 좋아하는건지 ㅉㅉ,2024-09-30 14:21:04
구근회,대단하고 존경스럽다 이스라엘,2024-09-30 14:21:05
인생의낙원,이란 지금 개쫄앗다던데 ㅋㅋ,2024-09-30 14:21:10
앙앙,국제적 합의가 된건데 혼자만 강도라고 하면 머가 달라지나...,2024-09-30 14:21:12
david,테러집다느재건이 그렇게ㅡ중요하냐 소멸시켜야지,2024-09-30 14:21:16
한국최강,도발하면 댓가를 톡톡히 치르는 게 당연지사.,2024-09-30 14:21:29
아늘한,일본에 알아서 기는 놈도 있는데,2024-09-30 14:21:32
Theophilus ,언제까지 확성기로만 응징을 끝낼지????,2024-09-30 14:21:50
훈,"뭐 저렇게 돈을 쓴다니, 지휘부 죽여봐야 어차피 다른 놈들이 규합해서 다시 만들텐데",2024-09-30 14:21:54
승리 진,●윤석렬은 제발 법과원칙에 따라 강하게 좌파들을 척결하라! 그것이 당신이 사는길입니다!,2024-09-30 14:21:55
승리 진,●윤석렬은 제발 법과원칙에 따라 강하게 좌파들을 척결하라! 그것이 당신이 사는길입니다!,2024-09-30 14:22:11
UFO외계연구소 ,북한독재자의 호구노릇하는 문재인이보단 낫다,2024-09-30 14:22:19
아늘한,맨날 알라래,2024-09-30 14:22:25
인생의낙원,알라 : 난 그러라고 한적없는데?,2024-09-30 14:22:34
jamon love,신의 뜻이라...^^,2024-09-30 14:22:35
Theophilus ,하셈도 곧 가겠군,2024-09-30 14:22:39
신사임당,앗살라마이쿰,2024-09-30 14:22:41
앙앙,지휘부가 몰살당했는데 다시 만들어도 적극적으로 못하지 ㅋㅋ,2024-09-30 14:22:48
경여 남,여기 공산당 많네,2024-09-30 14:22:50
아늘한,함드릴라,2024-09-30 14:22:53
냐옹이,후티 할것도 없네,2024-09-30 14:22:57
창전,이스라엘은 유대교지 갑자기 뭔 기독교타령..;;,2024-09-30 14:23:02
UFO외계연구소 ,북한 김정은 무섭겄다 벙커버스터에 쫀다던데,2024-09-30 14:23:03
인생의낙원,이란 최고 지도자도 공습으로 죽을 가능성이 높음 ,2024-09-30 14:23:03
KorGuys,하늘에서 정의가 빗발친다,2024-09-30 14:23:10
나무판때기,이미 전면전 아닌가?,2024-09-30 14:23:15
이채영,종교가 참 많이 죽이는구나,2024-09-30 14:23:15
dmsqkswl,이제는 지하에 숨는다고 안죽는거 아니야 벙커버스터가 개무서움 ,2024-09-30 14:23:21
UFO외계연구소 ,이스라엘 이스마엘 바이블믿는 나라들봐라 2000년내내 전쟁이다 기독교 가톨릭 믿는자들 정신차려라,2024-09-30 14:23:40
아늘한,정은이 쫄아서 도망가면 어케하지,2024-09-30 14:23:43
Sabrii,"하마스, 헤즈볼라, 후티등 정부의 컨트롤도 안되고 도덕, 윤리를 벗어난 본인들의 이익을 위한 집단 행동을 하는 놈들임 ",2024-09-30 14:23:53
UFO외계연구소 ,정은이 죽일려고 이스라엘이 작전중이라는 첩보,2024-09-30 14:23:59
UFO외계연구소 ,정은이 어쩌냐,2024-09-30 14:24:02
승리 진,●대한민국도 이런. 강한 지도자가필요함!,2024-09-30 14:24:09
david,현무랑 k2 이스라엘에 보내줘라,2024-09-30 14:24:16
KorGuys,후티반군 암것도 못하노,2024-09-30 14:24:16
신사임당,정은이한테도 좀 쏴바라,2024-09-30 14:24:20
Hansoo Jang,정부가 힘이 있어야 응징도 하지요 매일 카더라 통신동원해서 탄핵한다고 흔들어 놓는데 북한에 대응할 시간이 어디에 있어요 야당 괴담대응도 힘들고 동조하는 한동훈 대응도 어려운데 힘을 실어줘야지 일을 하지요,2024-09-30 14:24:22
승리 진,●윤석렬은 제발 법과원칙에 따라 강하게 좌파들을 척결하라! 그것이 당신이 사는길입니다!,2024-09-30 14:24:26
김동현,후티 후퇴,2024-09-30 14:24:31
문재인,대한민국은 이미 강한지도자가 있다,2024-09-30 14:24:32
Jack Shin,몇천년동안 사람을죽이나 종교라는것들이,2024-09-30 14:24:36
아늘한,가방도 못이기는 놈도 있다,2024-09-30 14:24:37
Rosa,테러 전문 국가(이란)가 전면전 쉽지 않을텐데..ㅎㅎ,2024-09-30 14:24:38
KorGuys,이스라엘 혼자 무쌍찍고 있네,2024-09-30 14:24:46
Theophilus ,"뉴스래 나오고도 살아 남은 놈, 죄전쟁(Sinwar)만 나았나?",2024-09-30 14:24:50
훈,이스라엘 사람들 우리나라 기독교인들 비아돌로로사에서 십자가 지고 가는 모습 보면서 비웃는 모습 생각남,2024-09-30 14:24:55
문재인,이미 강한지도자다 대한민국은,2024-09-30 14:25:02
가온해,후티도 제거해야지 예맨도 이제는 정리해야해 이란은 안끼는데없고 테러집단이야,2024-09-30 14:25:07
훈,술에 강한 지도자지,2024-09-30 14:25:19
Rosa,이스라엘 파이팅 ~,2024-09-30 14:25:22
뽀율s,정작 돈줄인 카타르 사우디 UAE 는 조용함 ㅋㅋ,2024-09-30 14:25:27
영홉스,예멘은 이때 반군을 몰아내고 통일을 하지 뭘하나?,2024-09-30 14:25:32
dmsqkswl,간첩들특 우리나라 둘로갈라놓은 중국은 욕안함 ㅇㅈ?,2024-09-30 14:25:39
방귀뀐놈이똥싼다,그거 아냐 적그리스도는이스라엘인걸?,2024-09-30 14:25:44
Hansoo Jang,봐요 저런 괴담 퍼트리는 넘부터 북한으로 보내야,2024-09-30 14:25:46
Hie-Eun Lee,아파트 아래에 헤즈볼라 이지트가 있으니 때렸겠지,2024-09-30 14:26:01
classictutor,그럼 이라크에 미사일을 판다는게 말이되나?,2024-09-30 14:26:06
Theophilus ,"죄전쟁, Sinwar는 왜 처단 못하고 있는지?",2024-09-30 14:26:12
C C,"ㅄ 유사 민주주의 국가 지금 k황금방패 반대 표 삭제되고 있는중 찬성표만 남아 있는 상태다 다시 반대표들 던지러 가라 그리고 개정된 아청법 범위에 모욕, 명예훼손, 사자명예훼손 추가됨",2024-09-30 14:26:12
living kim,예멘의 후티반군 공격은 사우디가 눈감아주지 않고서는 불가능할 것 같은 데,2024-09-30 14:26:12
이정훈,사우디는 이스라엘보다 이란을 더 싫어하니깐 조용한거고,2024-09-30 14:26:15
아리까리,대한민국 검찰 보내면 전부 끝장낼수있을텐데..,2024-09-30 14:26:21
문재인,이미 한국에는 제일 강한지도 자가있다.,2024-09-30 14:26:26
남자김성용,멋진나라야. 이스라엘 같은 지도자가 필요한 대한민국이다,2024-09-30 14:26:28
방귀뀐놈이똥싼다,이스라엘은 메시아를 기다린다 그러므로 적그리스도 이다,2024-09-30 14:26:35
뽀율s,카타르 UAE 사우디가 돕지 않는이상 헤즈볼라 백기들어야함,2024-09-30 14:26:35
Theophilus ,뜸들이기!,2024-09-30 14:26:40
GoKoTOUR,후티 대변인 밈도 이제 고인드립이 될려나,2024-09-30 14:26:46
이형근,지지율 25% 는 허약한 지도력이 아닐까,2024-09-30 14:26:55
신사임당,이스라엘봐라 공중권에서 그냥 다 쳐발른다,2024-09-30 14:26:57
훈,네타냐후는 전쟁이 길어지길 원한다 ㅎㅎ,2024-09-30 14:26:59
김지훈,중요한건 일본의 마음이라는 대통령 편드는 친일매국노 채팅창에 많이 보이네~ 세상이 참 좋아졌어. 옛날이였으면 암살당했을텐데.....,2024-09-30 14:27:01
dmsqkswl,근데 저동네는 너무 복잡해 ,2024-09-30 14:27:02
디톡스,한국말 잘 못해여,2024-09-30 14:27:14
Y모델,이스라엘은 중동의 미국인데 왜자꾸 나대는거지 ,2024-09-30 14:27:25
문재인,역사상 한국에서 제일 강한 지도자.가 있다,2024-09-30 14:27:36
디톡스,저아저씨 어어 좀 그만하라고 해줘,2024-09-30 14:27:37
뽀율s,이집트는 왕년에 덤볐다가 땅뺏긴적있어서 이스라엘한테 안덤빔 ㅋㅋㅋ,2024-09-30 14:27:49
dmsqkswl,일단 이스라엘은 공군력이 장난 아니잖아 ,2024-09-30 14:27:49
Randy Rhoads,결국 목표는 이란참전 끌어내서 패주는거겠지.... 미국도 말리는척하면서 어쩔수 없었다는 식으로 같이 패줄거고. ㅋㅋ,2024-09-30 14:27:51
Y모델,그냥 전부 석기시대로 만들어서 시비 못걸게 해라 ,2024-09-30 14:27:52
dmsqkswl,그냥 공군력으로 다처바름,2024-09-30 14:27:57
Earendel,불바다 보러 왔더니,2024-09-30 14:28:17
Earendel,말만 존나 많네,2024-09-30 14:28:19
신사임당,미사일 날린 댓가 받아야지,2024-09-30 14:28:20
Earendel,개노잼,2024-09-30 14:28:21
아늘한,하마스가 처들어 오는거 묵인했다는 소리네 ,2024-09-30 14:28:31
디톡스,전쟁이 재밌냐,2024-09-30 14:28:32
뽀율s,예전에 이집트가 이란믿고 덤볐다가 이스라엘한테 땅뺐겼다가 돌려받았자나 ㅋㅋㅋ,2024-09-30 14:28:38
ᄉᄅ,미필으 ㄴ안되,2024-09-30 14:28:39
dmsqkswl,그래서 형들 이란 참전한데?,2024-09-30 14:28:43
소리국민의,정말 대단하다 이스라엘 존경한다,2024-09-30 14:28:51
이정훈,이스라엘 F35만해도 40대있는데 전투기하나없는 이란이 뭘한다고 그냥 가만히 있어라 이란아,2024-09-30 14:28:58
디톡스,@Earendel 제발 인간이 되라,2024-09-30 14:29:01
디톡스,제발,2024-09-30 14:29:03
문재인,하마스 처들어온게 아니라 하마스내 이스라엘 스파이가 저지를 테러임,2024-09-30 14:29:05
엽이,포쓰 쩐다,2024-09-30 14:29:06
Randy Rhoads,미사일 20만개 있으면 한번에 쏘지 ㅋㅋ 방공망이 막을수 있는 만큼씩 나눠쓰냐 ㅋㅋ,2024-09-30 14:29:06
차무식,슨상님 알라신 전라지구 폭격 최후통첩 식량 물 전기 철조망 국경장벽 봉쇄,2024-09-30 14:29:08
dmsqkswl,난 이란 참전하는순간 아작날거같은데,2024-09-30 14:29:10
디톡스,입은 그러라고 달린게 아냐,2024-09-30 14:29:13
아늘한,"모사드가 정보력이 저리 대단한데, 처음에 하마스가 처들어오는 걸 모를리 없다",2024-09-30 14:29:17
Randy Rhoads,경험치 먹여주나,2024-09-30 14:29:18
문재인,하마스내에 이스라엘 스파이가 하마스 내에서 이스라엘 테러저질른것임,2024-09-30 14:29:34
soonja Kim,네타냐후 최고입니다 ...악의 축 하마스 헤즈볼라 후티반군 신속하고 깨끗히 제거해야 합니다.....,2024-09-30 14:29:36
문재인,이스라엘의 자작극이다,2024-09-30 14:29:39
신사임당,미사일 쏘는순간 위성 다 포착하고 부근 폭격 다날릴거임,2024-09-30 14:29:43
용화,저 나라는 방공 미사일도 없이 들이 댔을까? 아니면 미사일에 들어간 반도체가 미국설계라서 일시 먹통시켜서 저럴까 궁금해짐.,2024-09-30 14:29:46
Duke,속보)이란 참전결정 순항미사일발사임박,2024-09-30 14:30:01
kyunghwan,"중국 댓글부대 실체 확인,,경찰 수사 개시",2024-09-30 14:30:05
Randy Rhoads,쟤네들은 방공망이 필요없이... 민간이 고기방패뒤에 숨어서 쏘는데,2024-09-30 14:30:10
영웅본색,나도 법카로 초밥 :sushi: 먹고 싶다 괴물 아,2024-09-30 14:30:15
뽀율s,이스라엘이 원하는 첫번째 목표는 가자지구 모두 이스라엘영토 만드는거임,2024-09-30 14:30:19
dmsqkswl,이란은 참전하는순간 미항공모함 가만안있을듯,2024-09-30 14:30:22
dmsqkswl,이란 참전하면 바로 미국도 참전함,2024-09-30 14:30:29
kyunghwan,"중국 댓글부대 실체 확인, 경찰 수사 돌입",2024-09-30 14:30:33
kyunghwan,"중국 댓글부대 실체 확인, 경찰 수사 돌입",2024-09-30 14:30:38
kyunghwan,"중국 댓글부대 실체 확인, 경찰 수사 돌입",2024-09-30 14:30:45
문재인,이스라엘 넘들이 팔레스타인 원주민들 학살 한거랑 마찬가지,2024-09-30 14:30:46
김상기,이라크 꼴을 봣는데 이란이 미치지 않고서야 ㅋㅋㅋ,2024-09-30 14:30:52
신사임당,사우디 앉아서 꿀빠네,2024-09-30 14:30:53
누꼬,이란까지 청소하고 아프리카 쪽도 정리해라,2024-09-30 14:31:02
문재인,첨단 장비로 아직도 활이나 쏘는 원주민들 미사일로 학살 한것임,2024-09-30 14:31:02
Duke,속보) 중동에서 미국불참결정,2024-09-30 14:31:05
정욱 문,애초에 하마스 사건 부터가 의심스러움,2024-09-30 14:31:07
KorGuys, 미국은 겉으로만 말리는 척 하고 뒤로는 전적으로 지원하고 있는 중,2024-09-30 14:31:15
문재인,하마스가 정의다,2024-09-30 14:31:17
kyunghwan,"중국 댓글부대 실체 확인, 경찰 수사 돌입",2024-09-30 14:31:18
김태현 Tv ,이스라엘 뒤엔 미국이 있다 미국말도 안듣는 이스라엘 대단하다,2024-09-30 14:31:34
미스터쿤,여기 채팅창에 왜이렇게 거짓 선동뉴스가 판 치나요?,2024-09-30 14:31:37
문재인,헤즈볼라가 정의다 이스라엘은 침략자이자 사탄임,2024-09-30 14:31:38
이정훈,이란은 참전못하는게 이란지도자들만 난리임 정작 이란국민들은 대통령 헬기추락으로 죽어서 축제한 나라가 이란인데 무슨전쟁이고,2024-09-30 14:31:42
뽀율s,사우디는 지금 돈벌고 있을듯 한데 ㅎㅎ,2024-09-30 14:31:44
신사임당,미국돈줄 = 유댕니,2024-09-30 14:31:50
버기버기,중국인들 80%,2024-09-30 14:31:50
신사임당,유대인,2024-09-30 14:31:52
젤린오렌지,고작 초밥이냐?? 나는 법카로 호텔가고 싶다 1000만원짜리,2024-09-30 14:31:54
문재인,하마스 헤즈볼라. 한국으로 치면 일제시대 독립군들임,2024-09-30 14:32:02
kyunghwan,"겉으로는 말리는척 하지만 뒤로는 무기 다 대주고있습니다,,",2024-09-30 14:32:04
방구석판사TV,미쳐 날뛰네,2024-09-30 14:32:07
누꼬,하메이니만 제거하면 이란 민주화한다.,2024-09-30 14:32:16
김상기,이스라엘 때문에 러시아 ㅈ 됐네 우크라ㅓ이나도 러사어 본토까지 돌격하는거 아니냐? ㅋㅋㅋㅋ,2024-09-30 14:32:20
뽀율s,이란 대통령은 사단장한테 싸다구 맞음,2024-09-30 14:32:25
박박재철,이젠 이란만 남은듯 아주 다죽이고 이란과 1대1 맞짱뜰듯 미국은 전쟁을 원하지 않는다고 하면서 이스라엘에 유대인 민족에 무기무한공급해주고 바이든은 헛소리하고 있음 민주당은 유대인편임 유대인들이 미국을 지배하고 있으니 가능한듯 해리스 남편도 유대인임 ,2024-09-30 14:32:28
kyunghwan,"여차하면 미국 참전하고 중동,,이란 박살납니다,,이란 참전 못해요,,안하는게 아니라 못해요",2024-09-30 14:32:29
RAMA YO,이스라엘 싹 밀어서 세계지도에서 지워버리자,2024-09-30 14:32:33
딥슬로,말리는척하는거지 패권국이니깐 착한척해야지,2024-09-30 14:32:34
뽀율s,이란 대통령 권력 없어,2024-09-30 14:32:40
김지훈,협상하지않고 민간인들 머리위로 융단폭격한 이스라엘 편드는 인간이하인 사람들이 많군. 애초에 땅도 800년전에 우리땅이었다면서 무기들고와서 뺏었던 이스라엘인데 ㅋㅋㅋ 역사 공부 좀 plz..,2024-09-30 14:32:41
가을비,하마스 헤즈볼라를 지지하는 세력은 공산주의자..헤즈볼라 깔짝되다가 개발살 나는 중 다음은 후티..,2024-09-30 14:32:45
신사임당,미국은 이란 나대지말라고 경고,2024-09-30 14:32:53
kyunghwan,트럼프도 이스라엘 지지,2024-09-30 14:32:56
dmsqkswl,이란 참전하는순간 경제다 포기해아함 리스크가 크지,2024-09-30 14:32:56
AC Shark,조만간 레바논에 가자지구2 생길듯,2024-09-30 14:32:57
김길동,이란대통령 바지대통령,2024-09-30 14:32:57
Duke,이스라엘은 신나치,2024-09-30 14:33:05
박상진,미쿡이시키드나?,2024-09-30 14:33:10
젤린오렌지,결과론적 해설 아무나하는,2024-09-30 14:33:13
뽀율s,이란은 종교최고지도자가 대빵임,2024-09-30 14:33:14
 user-se5lx6ow3c4 ,이스라엘은 이번에 안잡으면 자리잡기 힘들지요,2024-09-30 14:33:15
가을비,이 전쟁은 자유민주주의와 공산주의 싸움,2024-09-30 14:33:16
kyunghwan,이란 하메네이도 곧 죽음,2024-09-30 14:33:18
신사임당,공군력 밀려서 참전못함,2024-09-30 14:33:29
젤린오렌지,나찌 이스라엘,2024-09-30 14:33:34
AC Shark,미쿡이 못하는거 이스라엘이 대신하는거임,2024-09-30 14:33:35
김길동,전세계 최고권력자 교황,2024-09-30 14:33:46
 user-se5lx6ow3c4 ,앞으로 미국에서 지원해주기 어렵다는 표현을 계속 하기때문에,2024-09-30 14:33:49
AC Shark,무장단체 붕괴시키는게 목적임,2024-09-30 14:33:49
man nang,전쟁은 원래 저렇게 하는거야,2024-09-30 14:33:59
박박재철,해리스되면 전쟁 안끝남 이스라엘이 이란을 칠거임 해리스 남편도 유대인이고 누구편을 들거임 해리스도 유대인편을 들거임 그래서 트럼프가 미국의 지배자 유대인을 비판하는거임 ,2024-09-30 14:34:02
man nang,나찌 ㅇㅈㄹ,2024-09-30 14:34:04
누꼬,하메이니 제거하면 끝난다. 이란 내부 분열함,2024-09-30 14:34:06
가을비,헤즈볼라 지지자는 공산주의자들 입니다,2024-09-30 14:34:07
이원희,아...,2024-09-30 14:34:07
김상기,지훈아 그럼 우리도 만약에 통일돼고 옛고구려영토 찿으면 안돼겟당???,2024-09-30 14:34:07
이원희,여기도 재패 해야지,2024-09-30 14:34:12
AC Shark,이스라엘총리 포스 넘치네..진정 상남자!!,2024-09-30 14:34:15
kyunghwan,테러를 배후에서 조장하는 이란 하메네이 죽이는게 목적입니다,2024-09-30 14:34:25
손오공,3차대전 빨리터져라 전쟁찬성,2024-09-30 14:34:34
kyunghwan,최종 목표는 이란 하메네이 제거,2024-09-30 14:34:41
이원희,그게 그렇지 안은게 말입니다.,2024-09-30 14:34:42
김지훈,이란이 테러한 이유는 알고있음? 미국이 내정간섭해서 꺼지라고 했는데 오히려 미국이 반군에 무기지원함. 웃긴건 그걸 또 들킴. 그리고 오리발 내밀고. 이란 국민들이 미국에 적대적으로 돌아서고. 미국은 자기말 안듣는 이란 미워서 경제제제가하고 지금에 이른거 아니여. 역사공부좀합시다잉,2024-09-30 14:34:52
이원희,후티란 해적이 언제 부터 난리 쳤나요?,2024-09-30 14:34:55
손오공,3차대전 빨리터져라 전쟁찬성,2024-09-30 14:34:59
김길동,통일ㅋ 북한이 핵이 있는디 뭔 통일...우리가 흡수되면 모를까 핵이 있는디 꿈같은소리,2024-09-30 14:35:08
미역,문재인 지지할거같은 사람 존나많노,2024-09-30 14:35:10
kyunghwan,미국 전트기 한번만 이란 훑으면 이란 정권 붕괴되고 작살남,2024-09-30 14:35:19
손오공,3차대전 빨리터져라 전쟁찬성,2024-09-30 14:35:24
이정훈,미국은 UN때문에 전쟁반대한다고 그러는거고 이스라엘이 미국대신 말안듣는 이란줘패주는거지,2024-09-30 14:35:24
 user-se5lx6ow3c4 ,인질은 없는 셈치고~ 그냥 가는구나 ㅎㅎ,2024-09-30 14:35:29
먹다버린단무지,이스라엘 그냥 북쪽 딱 반 잘라서 팔레스타인들 에게 줘라~~거서 살라고 대신 군대 창설은 못하게 하고,2024-09-30 14:35:29
스파크,핑계거리를 만드는거지~~~,2024-09-30 14:35:30
젤린오렌지,"트럼프도 유대인 가족 ㅋㅋㅋ 재러드 코리 쿠슈너(영어: Jared Corey Kushner, 1981년 1월 10일 ~ )는 미국의 사업가, 투자가이다. 미국 제45대 대통령 도널드 트럼프의 사위로, 장녀 이방카 트럼프의 남편이다. 아버지 찰스 쿠슈너는 유대인 부동산 개발업자",2024-09-30 14:35:31
료마80,이스라엘 미국보다 군사 강국이네,2024-09-30 14:35:45
젤린오렌지,개수작,2024-09-30 14:35:45
누꼬,이란 정리후 아프리카까지 정리,2024-09-30 14:35:46
늦은하루,문재인이 잘했지 ,2024-09-30 14:35:47
 user-se5lx6ow3c4 ,3차대전 나면 어짜피 죽을텐데 지금 로그아웃~,2024-09-30 14:35:49
료마80,이스라엘 세계1위 인정,2024-09-30 14:35:53
kyunghwan,"윤석열,,한국이 미국에 기는 이유",2024-09-30 14:35:58
junggil ha,민간인 포함된 융단폭격이네,2024-09-30 14:36:01
미역,훠훠 ,2024-09-30 14:36:03
kyunghwan,"미국에 덤비면 작살남,,,그래서 핵무기 필요함",2024-09-30 14:36:10
jj jj,헤즈벌라는 그냥 단체이고 북한은 나라임....전혀 틀린 얘기임.....,2024-09-30 14:36:15
뽀율s,김지훈 그거보다도 사우디가 미쿡 겁내 싫어했는데 친정책 하면서 벌어진거야 이란이 고립될까봐,2024-09-30 14:36:15
 user-se5lx6ow3c4 ,앞으로 이스라엘에서 폭탄터져도 할말없네,2024-09-30 14:36:17
나라,폭탄 박으면 꼼짝못해,2024-09-30 14:36:18
젤린오렌지,윤석열도 굳가락 ,2024-09-30 14:36:22
김길동,이스라엘 모사드 진짜 잘키워났네,2024-09-30 14:36:24
이원희,김지훈 // 한국으로 부터 원유 수출 대금을 거의 십년 만에 받은 이란.. 그 액수로 하마스와 헤즈볼라를 작동 시켰는데 그게 하필이면 용병으로 고용하는 형태가 되었지요 그들은 이스라엘이라는 하나의 적을 공격 하기 위해 움직였지만 이스라엘 군의 첨단화된 방호력에 흠집만 내고 사실상 실패했죠,2024-09-30 14:36:25
젤린오렌지,ㅛㅜㄷ가락,2024-09-30 14:36:26
미역,"듕국은 대국,,소국이지만 듕국몽 함꼐해",2024-09-30 14:36:34
뽀율s,최근 사우디가 미국한테 다가감,2024-09-30 14:36:46
문재인,예전에 로스트라다무스가 3차대전 예언했었지. 아랍에서부터 시작된다고 그랬다,2024-09-30 14:36:47
jj jj,북한은 만만한 나라가 아님....해즈볼라랑은 비교불가임,2024-09-30 14:36:50
김기현,모사드는 CIA랑 비슷한 급으로 언급되는것만 해도 이미 뭐,2024-09-30 14:36:57
 user-se5lx6ow3c4 ,쟤들은 참 불안하지.,2024-09-30 14:37:01
미역,:face-blue-smiling:,2024-09-30 14:37:04
료마80,출산율도 OECD 1위 군사능력도 1위 다음 생엔 이스라엘에서 태어나고 싶다!! ,2024-09-30 14:37:09
dmsqkswl,비교불가 ㅇㅈㄹ ㅋㅋㅋㅋㅋ 걍 허접임 무기다 썩었다,2024-09-30 14:37:11
 user-se5lx6ow3c4 ,우리도 저런 일 곧 생기겠지.,2024-09-30 14:37:16
문재인,이제 그 시기가 왔다고 생각한다. 핵전쟁이 임박했다. 러시아와 이란은 핵전쟁으로 시작할것이라 생각한다,2024-09-30 14:37:24
김길동,"헤즈볼라,후티,하마스 vs 북한 전쟁하면 북한이 3일안에 끝낸다",2024-09-30 14:37:32
Gold,후띠 대변인 아직 살아있네,2024-09-30 14:37:32
김기현,재래식 무기만 놓고 보면,2024-09-30 14:37:32
SM A,영원히 불타는 지옥으로. 죄가 너무 많다,2024-09-30 14:37:41
문재인,노스트라 다무스의 예언이 적중하겠구만,2024-09-30 14:37:41
김기현,헤즈볼라가 북한이랑도 꽤 싸울걸,2024-09-30 14:37:44
구독자youtube,"헤즈볼라는 공군, 지대공이 없어서 맞기만 해야됨 ",2024-09-30 14:37:45
이스칸,시원시원하네 ,2024-09-30 14:37:48
신사임당,대변인도 조만간 정리됨,2024-09-30 14:37:50
젤린오렌지,북한탱크 기름칠 덜됐다,2024-09-30 14:37:56
야옹이솜이,후티 ㅋㅋㅋㅋㅋ,2024-09-30 14:37:56
e sens,미국이 발빼는거 보니까 한국도 조만간이네 ,2024-09-30 14:37:57
야옹이솜이,까불고이써,2024-09-30 14:38:00
김길동,북한은 핵쏘눈골 주저하는 놈들이 아녀,2024-09-30 14:38:01
인자,이스라엘 시원시원하네,2024-09-30 14:38:01
야옹이솜이,후티 ㅋㅋㅋㅋ,2024-09-30 14:38:04
젤린오렌지,못움직여,2024-09-30 14:38:04
dmsqkswl,일단 공중이 장악되면 그냥 맞아야함,2024-09-30 14:38:07
Chgun J,그냥 이스라엘이 중동 통일하면 되지 않나? 한달이면 될 것 같은데,2024-09-30 14:38:09
신사임당,애개리 파이팅하는순간 그냥 벙커버스터 처맞고 골로감,2024-09-30 14:38:10
문재인,한국 큰일났다 이제,2024-09-30 14:38:10
청년문재인,파펫 폭탄드랍,2024-09-30 14:38:14
누꼬,더이상 놔두면 세계대전 난다,2024-09-30 14:38:14
휴 ! 식,1대17 3차대전 하라보네,2024-09-30 14:38:16
이정훈,북한 지금 무기 푸틴한테 다 뺏겨서 지금힘없다,2024-09-30 14:38:16
e sens,미군 이제 세계대전 와도 눈 끔뻑끔뻑 뜨고 무기만 팔아재낀다 ,2024-09-30 14:38:22
